{"artifact_hash":"00896d829f757a40e2c0fd585aa6dc41f29fa7324a38194f7f2bf885649834a2","dictionary_id":"NOuS6IE90Oem0D2YFymP","model_id":"eleven_multilingual_v2","name":"finance-core","rules":[{"added_episode":"current-bubble-mechanism","alias":"trillion wahn","note":"ep1 read as past tense of 'win'; scoped to the currency context (doc 22)","string_to_replace":"trillion won","type":"alias"},{"added_episode":"current-bubble-mechanism","alias":"billion wahn","note":"same homograph, scoped per doc 37 4b","string_to_replace":"billion won","type":"alias"},{"added_episode":"current-bubble-mechanism","alias":"million wahn","note":"same homograph, scoped per doc 37 4b","string_to_replace":"million won","type":"alias"},{"added_episode":"current-bubble-mechanism","alias":"AeroVironment","note":"ticker convention: spoken company names, not letters (probe 2026-08-24, operator ear verdict)","string_to_replace":"AVAV","type":"alias"},{"added_episode":"current-bubble-mechanism","alias":"Applied","note":"ticker spoken name (probe 2026-08-24, operator ear verdict)","string_to_replace":"APLD","type":"alias"},{"added_episode":"current-bubble-mechanism","alias":"laze","note":"ticker spoken name (probe 2026-08-24, operator ear verdict)","string_to_replace":"LASE","type":"alias"},{"added_episode":"current-bubble-mechanism","alias":"Ionic","note":"operator wants 'Ion-ick' (probe 2026-08-24, operator ear verdict)","string_to_replace":"IonQ","type":"alias"},{"added_episode":"current-bubble-mechanism","alias":"ay-sick","note":"spoken 'Ay-Sick', never spelled letters (probe 2026-08-24, operator ear verdict)","string_to_replace":"ASIC","type":"alias"},{"added_episode":"current-bubble-mechanism","alias":"T S M C","note":"initialism IS its spoken name; letters intended","string_to_replace":"TSMC","type":"alias"},{"added_episode":"current-bubble-mechanism","alias":"Kospee","note":"index name, spoken KOSS-pee not spelled out","string_to_replace":"KOSPI","type":"alias"},{"added_episode":"current-bubble-mechanism","alias":"S K hynix","note":"letters then name; prevents 'sk' being read as a word","string_to_replace":"SK hynix","type":"alias"}],"schema_version":"pronunciation_dictionary.v1","synced_rules_hash":"65de47d3b16a19011487b835e1a7600377f94bb215703b32a519b1979b0bf846","version_id":"RpXy0uG7pnaDRa8TFKE8"}
